id,date,collection,input_type,content_type,title,concept,key_takeaway,tags,use_cases,difficulty,source_url,user_note,obsidian_path
74e462b5-0d61-42b8-9a48-0f78458de260,2026-05-15T17:10:23.087140Z,default,VIDEO_WITH_TEXT,,Transforming Challenges into Opportunities,The post narrates a personal journey of overcoming adversity through skill investment and entrepreneurship in the data and AI fields. It emphasizes the importance of leveraging existing skills and taking calculated risks to achieve success.,,data-science;ai;upwork;consulting;education,building a consulting agency;creating an education platform,intermediate,https://www.instagram.com/reel/DYKMrvHsS78/?utm_source=ig_web_button_native_share,,
43d34fdc-9d62-4f88-bc34-ac32eb3dd4c1,2026-05-15T17:46:47.085474Z,default,VIDEO_WITH_TEXT,industry-insight,Classic Machine Learning Algorithms in Business,"Despite the rise of AI and large language models, many businesses still rely on traditional machine learning algorithms to solve critical problems. Understanding these classic techniques is essential for professionals in the field, as they form the backbone of many operational processes and decision-making frameworks in various industries.",Mastering classic machine learning algorithms is crucial for driving business success.,machine-learning;linear-regression;logistic-regression;decision-trees;random-forest;gradient-boosting;k-means-clustering;feature-engineering;evaluation-metrics;data-leakage;experimentation;business-metrics;deployment;monitoring,sales forecasting;fraud detection;customer segmentation,intermediate,https://www.instagram.com/reel/DYC6ZlhPwqB/?utm_source=ig_web_button_native_share,,
47fa9eed-0c77-4df5-b7b2-3c88b12041d7,2026-05-15T18:24:04.899703Z,default,VIDEO_WITH_TEXT,technical-tutorial,Minimizing Latency with FPGAs in Trading,"This post discusses the use of colocation and FPGAs to minimize latency in high-frequency trading, particularly in the context of prediction markets. Understanding these techniques is crucial for traders looking to exploit inefficiencies in market pricing, as they can significantly enhance the speed and accuracy of trades.","Utilizing FPGAs and colocation can drastically reduce latency, allowing for more effective arbitrage opportunities.",prediction-markets;polymarket;hft;quant;arbitrage,high-frequency trading;market inefficiency exploitation,intermediate,https://www.instagram.com/reel/DYQg7V7otq5/?utm_source=ig_web_button_native_share,,
ed31d4c0-bb13-4ee1-91ea-176172dd2434,2026-05-15T18:27:38.763282Z,default,VIDEO_WITH_TEXT,industry-insight,The Future of Neural Interfaces,"Neural interfaces are emerging technologies that enable direct communication between the human brain and external devices, particularly AI. This innovation is significant as it could revolutionize how we interact with technology, enhancing capabilities in various fields such as healthcare, communication, and entertainment.",Neural interfaces are poised to transform human-AI interaction in unprecedented ways.,neural-interfaces;ai;technology;healthcare;communication,enhancing communication for individuals with disabilities;improving human-computer interaction,intermediate,https://www.instagram.com/reel/DYTFHFvSmae/?utm_source=ig_web_button_native_share,,
a9090a3a-6e5d-4ce2-848c-2123f16b6fbe,2026-05-15T18:33:24.443419Z,default,IMAGE_WITH_TEXT,technical-tutorial,10 Essential Python One-Liners for Analysts,"This post highlights ten powerful one-liners in Python using the pandas library that can significantly streamline data analysis tasks. By automating repetitive processes like data cleaning and visualization, analysts can save valuable time and focus on more strategic decision-making.",Utilizing Python one-liners can drastically reduce the time spent on manual data tasks.,python;pandas;data-analytics;data-cleaning;data-visualization,automating data cleaning;creating quick visualizations,beginner,https://www.instagram.com/p/DX6324wlLEQ/?utm_source=ig_web_button_native_share,,
